{
  "$schema": "../schema/baseline.schema.json",
  "사업": {
    "사업명": "'23년 강소형 아산시 스마트시티 조성사업",
    "내역사업명": "강소형 스마트도시 조성사업",
    "소관부처": "국토교통부",
    "전담기관": "한국스마트도시협회",
    "사업기간": {
      "개시일": "2023-12-11",
      "종료일": "2026-12-31",
      "confirmed": true,
      "근거문서": "보조사업 집행결과 제출 양식(별첨4) 기재 — '23.12.11 ~ '26.12.31"
    },
    "준공기준시점": {
      "기준일": "2026-12-31",
      "판정근거": "잠정. 협약 제14조② 3년 운영의무 기산점과 연동",
      "confirmed": false
    },
    "총사업비": {
      "금액": 24000000000,
      "재원별": {
        "국비": 12000000000,
        "도비": 2880000000,
        "시비": 9120000000,
        "자기부담금": 0
      },
      "confirmed": false,
      "근거문서": "총액 240억원은 양식으로 확인. 재원별 배분은 협약서 대조 필요"
    },
    "세부사업명": "디지털 OASIS 구현을 통한 지역 경제 활성화 및 데이터 기반 스마트시티 조성",
    "기관명": "㈜제일엔지니어링종합건축사사무소",
    "총괄책임자": "상무 이성호"
  },
  "재원비율": {
    "국비": 50,
    "도비": 12,
    "시비": 38,
    "자기부담금": 0,
    "허용오차_퍼센트포인트": 1.0
  },
  "기관": [
    {
      "코드": "ASAN",
      "명칭": "아산시",
      "구분": "보조사업자",
      "교부액": {
        "총액": 24000000000
      },
      "검증대상": {
        "해당여부": false,
        "판정근거": "지방자치단체 — 보조금법 §27② 후단 제외"
      },
      "회계감사대상": {
        "해당여부": false,
        "판정근거": "지방자치단체 제외",
        "confirmed": true
      },
      "실적보고기한_개월": 3
    },
    {
      "코드": "JEIL",
      "명칭": "㈜제일엔지니어링종합건축사사무소",
      "구분": "직접보조사업자",
      "상위기관": "ASAN",
      "교부액": {
        "총액": 0
      },
      "검증대상": {
        "해당여부": true,
        "판정근거": "교부액 1억원 이상(시행령 §12의2②) — 금액 확정 후 재판정"
      },
      "회계감사대상": {
        "해당여부": false,
        "판정근거": "중앙관서 직접교부 아님 — 국토부 서면질의 필요",
        "confirmed": false
      },
      "실적보고기한_개월": 2
    },
    {
      "코드": "HOSEO",
      "명칭": "호서대학교 산학협력단",
      "구분": "간접보조사업자",
      "상위기관": "ASAN",
      "교부액": {
        "총액": 0
      },
      "검증대상": {
        "해당여부": true,
        "판정근거": "교부액 1억원 이상 예상 — 금액 확정 후 재판정"
      },
      "회계감사대상": {
        "해당여부": false,
        "판정근거": "국토부 서면질의 필요",
        "confirmed": false
      },
      "실적보고기한_개월": 2
    },
    {
      "코드": "CNI",
      "명칭": "충남연구원",
      "구분": "간접보조사업자",
      "상위기관": "ASAN",
      "교부액": {
        "총액": 0
      },
      "검증대상": {
        "해당여부": true,
        "판정근거": "교부액 1억원 이상 예상 — 금액 확정 후 재판정"
      },
      "회계감사대상": {
        "해당여부": false,
        "판정근거": "국토부 서면질의 필요",
        "confirmed": false
      },
      "실적보고기한_개월": 2
    },
    {
      "코드": "KAIST",
      "명칭": "한국과학기술원",
      "구분": "간접보조사업자",
      "상위기관": "ASAN",
      "교부액": {
        "총액": 0
      },
      "검증대상": {
        "해당여부": true,
        "판정근거": "교부액 1억원 이상 예상 — 금액 확정 후 재판정"
      },
      "회계감사대상": {
        "해당여부": false,
        "판정근거": "국토부 서면질의 필요",
        "confirmed": false
      },
      "실적보고기한_개월": 2
    }
  ],
  "기한": {
    "중요재산_취득보고_일": 15,
    "계약서_시스템등록_일": 15,
    "감사인_선임_개월": 3,
    "감사보고서_제출_개월": 4,
    "자료보관_년": 5,
    "자료보관_목표년도": 2031
  },
  "정산기준": {
    "조달_물품용역_초과액": 20000000,
    "조달_건설공사_초과액": 200000000,
    "조달_전문공사_초과액": 100000000,
    "조달_기타공사_초과액": 80000000,
    "조달청검토_공사_이상액": 3000000000,
    "조달청검토_특수공사_이상액": 300000000,
    "설계변경_타당성검토_비율": 10,
    "중요재산_하한액": 500000,
    "복수견적_기준액": 1000000,
    "인정지급방법": [
      "계좌이체",
      "보조금전용카드"
    ]
  },
  "변경승인이력": [],
  "미확정사항": [
    {
      "항목": "2026년 교부액(국비·지방비) 확정",
      "확인처": "아산시",
      "중요도": "최상",
      "상태": "미질의",
      "질의번호": "1-1"
    },
    {
      "항목": "사업기간 종료일 및 준공 기준시점(협약 제14조②)",
      "확인처": "국토교통부·아산시",
      "중요도": "최상",
      "상태": "미질의",
      "질의번호": "2-1"
    },
    {
      "항목": "실적보고서 제출 경로(한국스마트도시협회 경유 여부) 및 기한",
      "확인처": "한국스마트도시협회",
      "중요도": "최상",
      "상태": "미질의",
      "질의번호": "2-2"
    },
    {
      "항목": "기관별 교부액 확정 및 정산보고서 검증 대상 판정",
      "확인처": "아산시",
      "중요도": "상",
      "상태": "미질의",
      "질의번호": "1-2"
    },
    {
      "항목": "회계감사(10억원 기준) 해당 여부",
      "확인처": "국토교통부",
      "중요도": "상",
      "상태": "미질의",
      "질의번호": "2-4"
    },
    {
      "항목": "미준공·이월 예상 단위사업의 이월승인 가능성",
      "확인처": "국토교통부·아산시",
      "중요도": "상",
      "상태": "미질의",
      "질의번호": "2-5"
    },
    {
      "항목": "중요재산 귀속주체 및 OASIS SPOT 부동산·동산 판정",
      "확인처": "국토교통부·아산시",
      "중요도": "상",
      "상태": "미질의",
      "질의번호": "2-6"
    },
    {
      "항목": "낙찰차액·예비비 잔액 처리방침",
      "확인처": "아산시",
      "중요도": "중",
      "상태": "미질의",
      "질의번호": "1-3"
    },
    {
      "항목": "현물투자(PM 노무) 정산 인정 범위 및 증빙 수준",
      "확인처": "국토교통부",
      "중요도": "중",
      "상태": "미질의",
      "질의번호": "2-7"
    },
    {
      "항목": "부가가치세 환급금 처리방침(세외수입/재투자)",
      "확인처": "아산시",
      "중요도": "중",
      "상태": "미질의",
      "질의번호": "1-4"
    },
    {
      "항목": "3년 운영단계 시작시점 및 운영예산 확보 일정",
      "확인처": "아산시",
      "중요도": "중",
      "상태": "미질의",
      "질의번호": "1-5"
    },
    {
      "항목": "간접보조사업자 검증 대상 1억원 기준의 산정 단위(누적/연도별, 기관별/합산)",
      "확인처": "국토교통부",
      "중요도": "상",
      "상태": "미질의",
      "질의번호": "2-3"
    }
  ],
  "연도별교부내역": [
    {
      "연도": 2024,
      "국비": 9000000000,
      "지방비": 3550000000,
      "confirmed": true,
      "비고": "총 12,550,000,000원"
    },
    {
      "연도": 2025,
      "국비": 3000000000,
      "지방비": 4550000000,
      "confirmed": true,
      "비고": "총 7,550,000,000원"
    },
    {
      "연도": 2026,
      "국비": 0,
      "지방비": 0,
      "confirmed": false,
      "비고": "양식 원문 수치 판독 불가 — 교부결정통지서로 확정 필요"
    }
  ]
}